<?xml version="1.0" encoding="UTF-8"?>
<dataroot xmlns:od="urn:schemas-microsoft-com:officedata" xmlns:xsi="http://www.w3.org/2001/XMLSchema-instance"  xsi:noNamespaceSchemaLocation="2019‑02‑02_-_Albanian_Languages_list_Access_backup.xsd" generated="2019-02-02T23:42:32">
<Albanian_Languages>
<Albanian_Languages>Jllvrianishtë</Albanian_Languages>
<Albanina_Languages_ID>1</Albanina_Languages_ID>
</Albanian_Languages>
<Albanian_Languages>
<Albanian_Languages>Qrêguishtë</Albanian_Languages>
<Albanina_Languages_ID>2</Albanina_Languages_ID>
</Albanian_Languages>
<Albanian_Languages>
<Albanian_Languages>Latinishtë</Albanian_Languages>
<Albanina_Languages_ID>3</Albanina_Languages_ID>
</Albanian_Languages>
<Albanian_Languages>
<Albanian_Languages>Persishtë</Albanian_Languages>
<Albanina_Languages_ID>4</Albanina_Languages_ID>
</Albanian_Languages>
<Albanian_Languages>
<Albanian_Languages>Shemitikishtë</Albanian_Languages>
<Albanina_Languages_ID>5</Albanina_Languages_ID>
</Albanian_Languages>
<Albanian_Languages>
<Albanian_Languages>Slavikishtë</Albanian_Languages>
<Albanina_Languages_ID>6</Albanina_Languages_ID>
</Albanian_Languages>
<Albanian_Languages>
<Albanian_Languages>Hindianishtë</Albanian_Languages>
<Albanina_Languages_ID>7</Albanina_Languages_ID>
</Albanian_Languages>
<Albanian_Languages>
<Albanian_Languages>Zhermanishtë</Albanian_Languages>
<Albanina_Languages_ID>8</Albanina_Languages_ID>
</Albanian_Languages>
<Albanian_Languages>
<Albanian_Languages>Altaikishtë</Albanian_Languages>
<Albanina_Languages_ID>9</Albanina_Languages_ID>
</Albanian_Languages>
</dataroot>
